"","Title","Currency","amountAwarded","awardDate","Organisation","fundingOrg","fundingDept","grantProgramme","amountRequested","orgSize"
"807","Grant to Tower Bridge Primary School","GBP",15000,2018-01-31,"Tower Bridge Primary School","Greater London Authority","Development, Enterprise & Environment","Greener City Fund: Community Green Space Grants",21054.0092520974,"large"
"808","Grant to St Joseph's Roman Catholic Primary School","GBP",10000,2018-01-31,"St Joseph's Roman Catholic Primary School","Greater London Authority","Development, Enterprise & Environment","Greener City Fund: Community Green Space Grants",8218.92859262539,"med"
"809","Grant to Boutcher Primary School","GBP",9018.75,2018-01-31,"Boutcher Primary School","Greater London Authority","Development, Enterprise & Environment","Greener City Fund: Community Green Space Grants",11463.7019774919,"med"
"810","Grant to Goose Green School","GBP",6051.5,2018-01-31,"Goose Green School","Greater London Authority","Development, Enterprise & Environment","Greener City Fund: Community Green Space Grants",7497.01416656522,"large"
"811","Grant to Oliver Goldsmith Primary School","GBP",12500,2018-01-31,"Oliver Goldsmith Primary School","Greater London Authority","Development, Enterprise & Environment","Greener City Fund: Community Green Space Grants",15003.7127821507,"small"
"812","Grant to Charlotte Sharman Primary School","GBP",10000,2018-01-31,"Charlotte Sharman Primary School","Greater London Authority","Development, Enterprise & Environment","Greener City Fund: Community Green Space Grants",11674.2519088731,"small"
"813","Grant to Marner Primary School","GBP",30000,2018-01-31,"Marner Primary School","Greater London Authority","Development, Enterprise & Environment","Greener City Fund: Community Green Space Grants",39544.814194735,"small"
"814","Grant to St Anselm's Catholic Primary School","GBP",10000,2018-01-31,"St Anselm's Catholic Primary School","Greater London Authority","Development, Enterprise & Environment","Greener City Fund: Community Green Space Grants",6309.21379734463,"large"
"815","Grant to St Peter's Eaton Square C of E Primary School","GBP",7000,2018-01-31,"St Peter's Eaton Square CofE Primary School","Greater London Authority","Development, Enterprise & Environment","Greener City Fund: Community Green Space Grants",5975.39123920486,"med"
"816","Grant to St Clement Danes CE Primary School","GBP",7500,2018-01-31,"St Clement Danes CE Primary School","Greater London Authority","Development, Enterprise & Environment","Greener City Fund: Community Green Space Grants",9777.68474366037,"med"
"817","Grant to St Mary's Bryanston Square CE Primary School","GBP",7500,2018-01-31,"St. Marys Bryanston Square CE Primary","Greater London Authority","Development, Enterprise & Environment","Greener City Fund: Community Green Space Grants",6813.21241120838,"med"
"818","Grant to Trees for Cities","GBP",50000,2018-01-31,"Trees for Cities","Greater London Authority","Development, Enterprise & Environment","Greener City Fund: Community Green Space Grants",64787.6591807568,"large"
"819","Refugee All Stars #We Stand Together","GBP",139130,2018-10-31,"Croydon Voluntary Action","Greater London Authority","Sport Team","London Together Fund",134280.500337413,"large"
"820","Tottenham Silver Sports","GBP",131088,2018-11-01,"Groundwork London","Greater London Authority","Sport Team","London Together Fund",169815.937324415,"med"
"821","Shared Futures","GBP",123200,2018-11-02,"Celtic FC Foundation","Greater London Authority","Sport Team","London Together Fund",179873.15416833,"large"
"822","FBB: Every Ends","GBP",117500,2018-11-03,"Football Beyond Borders","Greater London Authority","Sport Team","London Together Fund",112378.925082024,"small"
"823","Muslim Girls Fence - Communities","GBP",111000,2018-11-04,"Maslaha","Greater London Authority","Sport Team","London Together Fund",122365.7430277,"large"
"824","London Futures","GBP",104920,2018-11-05,"The Change Foundation","Greater London Authority","Sport Team","London Together Fund",108269.539725075,"small"
"825","Sport for Inclusion","GBP",64253,2018-11-06,"The Royal Society for Blind Children (RSBC)","Greater London Authority","Sport Team","London Together Fund",99394.3887395274,"large"
"826","Women Together in Finsbury Park","GBP",64352,2018-11-07,"Holloway Neighbourhood Group","Greater London Authority","Sport Team","London Together Fund",73509.2705942332,"large"
"827","East London United","GBP",61259,2018-11-08,"Salaam Peace","Greater London Authority","Sport Team","London Together Fund",71664.7854372272,"large"
"828","Badu Sport Summer Camp","GBP",15000,2018-07-31,"Badu Sport","Greater London Authority","Sport Team","YLF Impact Partnerships 2018 - Summer Activity",14303.6735825316,"small"
"829","Box Up Crime Summer Activity Programme","GBP",10000,2018-08-01,"Box Up Crime","Greater London Authority","Sport Team","YLF Impact Partnerships 2018 - Summer Activity",13392.7817913728,"large"
"830","Street Tekkars Outreach","GBP",10000,2018-08-02,"Hackney Wick FC","Greater London Authority","Sport Team","YLF Impact Partnerships 2018 - Summer Activity",12796.1823758498,"large"
"831","Ignite Trust Summer Activity Pogramme","GBP",10000,2018-08-03,"Ignite Trust","Greater London Authority","Sport Team","YLF Impact Partnerships 2018 - Summer Activity",8978.03093186159,"large"
"832","Key4Life Summer Activity Programme","GBP",15000,2018-08-04,"Key4Life","Greater London Authority","Sport Team","YLF Impact Partnerships 2018 - Summer Activity",20242.2176104205,"small"
"833","Getting Ready","GBP",20000,2018-08-05,"London Youth","Greater London Authority","Sport Team","YLF Impact Partnerships 2018 - Summer Activity",26120.8211756921,"small"
"834","XLP Summer Activity Programme","GBP",10000,2018-08-06,"XLP","Greater London Authority","Sport Team","YLF Impact Partnerships 2018 - Summer Activity",11889.5761404884,"small"
"835","ISC Links","GBP",62075,2018-10-01,"Islington Somali Community","Greater London Authority","Sport Team","YLF Sport Unites Small Grants",75876.9195022716,"large"
"836","Community Sports Coaches","GBP",90000,2018-10-02,"SkyWay Charity","Greater London Authority","Sport Team","YLF Sport Unites Small Grants",61790.0807387783,"med"
"837","ARCA Active","GBP",30000,2018-10-03,"ARCA Generation","Greater London Authority","Sport Team","YLF Sport Unites Small Grants",40985.4969103618,"large"
"838","Flying Fish (anything is possible!): supporting disadvantaged young Londoners to reach their potential","GBP",86875,2018-10-04,"Get Hooked on Fishing","Greater London Authority","Sport Team","YLF Sport Unites Small Grants",53115.4474684245,"large"
"839","Active Lives! (Making a difference thru' sports)","GBP",88565,2018-10-05,"Southside Young Leader's Academy","Greater London Authority","Sport Team","YLF Sport Unites Small Grants",102315.208246457,"med"
"840","Lambeth Riding Stars","GBP",81187,2018-10-06,"Ebony Horse Club","Greater London Authority","Sport Team","YLF Sport Unites Small Grants",69039.2709246696,"med"
"841","SOHK for Schools  Changing Lives, Creating Futures","GBP",87840,2018-10-07,"School of Hard Knocks","Greater London Authority","Sport Team","YLF Sport Unites Small Grants",112660.386759644,"small"
"842","Snow-Camp London","GBP",90000,2018-10-08,"Snow Camp","Greater London Authority","Sport Team","YLF Sport Unites Small Grants",86437.7524087476,"small"
"843","Chance to Shine Street Programme","GBP",1e+05,2018-07-30,"Chance to Shine","Greater London Authority","Sport Team","YLF Impact Partnerships 2018",138365.151683216,"large"
"844","Fight for Peace Programme","GBP",95000,2018-07-31,"Fight for Peace","Greater London Authority","Sport Team","YLF Impact Partnerships 2018",131444.344881974,"med"
"845","Street Games Programme","GBP",120000,2018-08-01,"StreetGames","Greater London Authority","Sport Team","YLF Impact Partnerships 2018",129312.273819643,"small"
"846","The Change Foundation Programme","GBP",95000,2018-08-02,"The Change Foundation","Greater London Authority","Sport Team","YLF Impact Partnerships 2018",107395.320808342,"med"
"847","Key4Life: Unlocking the potential of young Londoners","GBP",148800,2018-08-03,"Key4Life","Greater London Authority","Education and Youth","YLF Medium Grants",117917.569824178,"large"
"848","FBB Schools: Positive Choices, Different Paths","GBP",139766,2018-08-04,"Football Beyond Borders","Greater London Authority","Education and Youth","YLF Medium Grants",188770.760977187,"small"
"849","Connect","GBP",150000,2018-08-05,"Charlton Athletic Community Trust","Greater London Authority","Education and Youth","YLF Medium Grants",152134.142339484,"large"
"850","On the Ball","GBP",149601,2018-08-06,"QPR in the Community Trust","Greater London Authority","Education and Youth","YLF Medium Grants",134971.178679905,"small"
"851","Detatched Youth Work and Prison Pathway Project","GBP",120000,2018-08-07,"Ignite Trust","Greater London Authority","Education and Youth","YLF Medium Grants",105806.559483469,"small"
"852","All Aboard","GBP",149296,2018-08-08,"The AHOY Centre","Greater London Authority","Education and Youth","YLF Medium Grants",169393.49502708,"med"
"853","Nex Gen","GBP",149515,2018-08-09,"Access to Sports Project","Greater London Authority","Education and Youth","YLF Medium Grants",194296.582163015,"med"
"854","Performance Pathways Sportsaid 2018","GBP",1e+05,2018-05-25,"Sportsaid","Greater London Authority","Sport Team","Sportsaid",134617.449355709,"med"
"855","Schools Energy Cooperative Limited","GBP",15000,2018-09-24,"Schools Energy Cooperative Limited","Greater London Authority","Development, Enterprise & Environment","London Community Energy Fund (LCEF)",22031.0983515241,"large"
"856","Schools Energy Cooperative Limited","GBP",15000,2018-11-14,"Schools Energy Cooperative Limited","Greater London Authority","Development, Enterprise & Environment","London Community Energy Fund (LCEF)",14469.3446437077,"small"
"857","London Sustainability Exchange (LSx)","GBP",6130,2018-10-24,"London Sustainability Exchange (LSx)","Greater London Authority","Development, Enterprise & Environment","London Community Energy Fund (LCEF)",8017.83611176064,"large"
"858","London Sustainability Exchange (LSx)","GBP",6130,2018-10-24,"London Sustainability Exchange (LSx)","Greater London Authority","Development, Enterprise & Environment","London Community Energy Fund (LCEF)",9210.96479527212,"small"
"859","Highbury Vale Blackstock Trust","GBP",2666,2018-11-14,"Highbury Vale Blackstock Trust","Greater London Authority","Development, Enterprise & Environment","London Community Energy Fund (LCEF)",3308.63794411497,"small"
"860","South East Community Energy (SELCE)","GBP",8722,2018-12-05,"South East Community Energy (SELCE)","Greater London Authority","Development, Enterprise & Environment","London Community Energy Fund (LCEF)",8054.15097996006,"large"
"861","South East Community Energy (SELCE)","GBP",14607,2018-11-26,"South East Community Energy (SELCE)","Greater London Authority","Development, Enterprise & Environment","London Community Energy Fund (LCEF)",14798.2043368836,"small"
"862","South East Community Energy (SELCE)","GBP",14901,2018-12-14,"South East Community Energy (SELCE)","Greater London Authority","Development, Enterprise & Environment","London Community Energy Fund (LCEF)",19293.985232594,"med"
"863","South East Community Energy (SELCE)","GBP",14837,2018-12-14,"South East Community Energy (SELCE)","Greater London Authority","Development, Enterprise & Environment","London Community Energy Fund (LCEF)",27279.5528679415,"large"
"864","En10ergy","GBP",4350,2018-11-30,"En10ergy","Greater London Authority","Development, Enterprise & Environment","London Community Energy Fund (LCEF)",5301.26635937547,"large"
"865","Repowering Limited","GBP",12450,2018-12-10,"Repowering Limited","Greater London Authority","Development, Enterprise & Environment","London Community Energy Fund (LCEF)",17824.3313607036,"large"
"866","Repowering Limited","GBP",7370,2018-12-14,"Repowering Limited","Greater London Authority","Development, Enterprise & Environment","London Community Energy Fund (LCEF)",7477.54311723964,"small"
"867","Repowering Limited","GBP",15000,2018-12-10,"Repowering Limited","Greater London Authority","Development, Enterprise & Environment","London Community Energy Fund (LCEF)",13013.5582661778,"small"
"868","Bromley-by-Bow Centre","GBP",11950,2018-12-03,"Bromley-by-Bow Centre","Greater London Authority","Development, Enterprise & Environment","London Community Energy Fund (LCEF)",13984.7631844594,"small"
"869","Community Renewable Energy Wandsworth (CREW)","GBP",12500,2018-12-14,"Community Renewable Energy Wandsworth (CREW)","Greater London Authority","Development, Enterprise & Environment","London Community Energy Fund (LCEF)",20228.6406946304,"med"
"870","Holly Lodge Estate Committee","GBP",1882,2018-12-10,"Holly Lodge Estate Committee","Greater London Authority","Development, Enterprise & Environment","London Community Energy Fund (LCEF)",2044.4263187682,"med"
"871","Newbery House Cooperative","GBP",9740,2018-12-10,"Newbery House Cooperative","Greater London Authority","Development, Enterprise & Environment","London Community Energy Fund (LCEF)",7333.52273069876,"med"
"872","Public Works","GBP",8686,2018-12-10,"Public Works","Greater London Authority","Development, Enterprise & Environment","London Community Energy Fund (LCEF)",10762.278028216,"small"
"873","Chinese New Year 2019","GBP",50000,2019-01-15,"London Chinatown Chinese Association","Greater London Authority","External Affairs","Events for London Programme 2018/19",60361.1361706679,"med"
"874","Mayors School Air Quality Audit Programme","GBP",10000,2019-02-03,"St Mary's RC Primary School","Greater London Authority","Development, Enterprise & Environment","Mayors primary schools and nurseries air quality audit programmes (2018/19)",14170.1673354787,"large"
"875","Air Quality Programme - King's College London","GBP",112490,2019-02-15,"King's College London","Greater London Authority","Development, Enterprise & Environment","C40 air quality hyper-local sensor programme",148639.148696946,"med"
"876","Digital Talent Programme","GBP",4e+05,2019-01-31,"Capital Enterprise (UK) Limited","Greater London Authority","Development, Enterprise & Environment","Digital Talent programme",474612.340164478,"small"
"877","Digital Talent Programme","GBP",240000,2019-01-24,"A New Direction London Limited","Greater London Authority","Development, Enterprise & Environment","Digital Talent programme",273551.402952605,"med"
"878","Mayor's Construction Academy Hub Status","GBP",2e+05,2018-11-01,"LB Barking and Dagenham","Greater London Authority","Development, Enterprise & Environment","Mayors Construction Academy Scheme",330399.528477031,"med"
"879","Housing Infrastructure Fund","GBP",90000,2019-03-25,"LB Enfield","Greater London Authority","Housing and Land","Supporting developments with a High Level of Affordable Housing",126425.560147817,"med"
"880","Mayor's Construction Academy Hub Status","GBP",2e+05,2018-10-23,"LB Camden","Greater London Authority","Development, Enterprise & Environment","Mayors Construction Academy Scheme",268801.207923147,"small"
"881","Mayor's Construction Academy Hub Status","GBP",166500,2018-10-29,"Bromley College of Further & Higher Education","Greater London Authority","Development, Enterprise & Environment","Mayors Construction Academy Scheme",280700.247116227,"large"
"882","Mayor's Construction Academy Hub Status","GBP",249750,2018-10-24,"London South Bank University","Greater London Authority","Development, Enterprise & Environment","Mayors Construction Academy Scheme",280017.142130966,"small"
"883","Grant to Partnership for Young London","GBP",9800,2019-03-01,"Partnership for Young London","Greater London Authority","Team London","Team London and Thrive LDN Grants",12140.0032592007,"large"
"884","Grant to Carers Support Merton","GBP",9667,2019-03-01,"Carers Support Merton","Greater London Authority","Team London","Team London and Thrive LDN Grants",14992.7004696659,"small"
"885","Grant to Leaders in Community","GBP",7852,2019-03-01,"Leaders in Community","Greater London Authority","Team London","Team London and Thrive LDN Grants",9030.67287033841,"large"
"886","Grant to Volunteer Centre Kensington and Chelsea","GBP",10000,2019-03-01,"Volunteer Centre Kensington and Chelsea","Greater London Authority","Team London","Team London and Thrive LDN Grants",10428.4530436077,"small"
"887","Grant to Breadwinners","GBP",10000,2019-03-01,"Breadwinners","Greater London Authority","Team London","Team London and Thrive LDN Grants",13085.6977396542,"small"
"888","Grant to St Mary's Secret Garden","GBP",10000,2019-03-01,"St Mary's Secret Garden","Greater London Authority","Team London","Team London and Thrive LDN Grants",10399.5374555882,"med"
"889","Grant to Community Action for Refugees and Asylum Seekers (CARAS)","GBP",9852,2019-03-01,"Community Action for Refugees and Asylum Seekers (CARAS)","Greater London Authority","Team London","Team London and Thrive LDN Grants",11308.6294467244,"med"
"890","Grant to Innovative Vision Organisation","GBP",10000,2019-03-01,"Innovative Vision Organisation","Greater London Authority","Team London","Team London and Thrive LDN Grants",13440.5208315319,"large"
"891","Grant to Tender Education and Arts","GBP",50000,2019-03-01,"Tender Education and Arts","Greater London Authority","Team London","Team London and Thrive LDN Grants",45879.0258411457,"small"
"892","Grant to Skyway Charity","GBP",50000,2019-03-01,"Skyway Charity","Greater London Authority","Team London","Team London and Thrive LDN Grants",73372.1075026545,"med"
"893","Grant to Carers of Barking and Dagenham","GBP",41230,2019-03-01,"Carers of Barking and Dagenham","Greater London Authority","Team London","Team London and Thrive LDN Grants",52087.9383677951,"small"
"894","Grant to Abbey Community Centre","GBP",5430,2018-12-03,"Abbey Community Centre","Greater London Authority","Communities and Intelligence","Team London small grants",6920.01743391855,"small"
"895","Grant to Autus","GBP",12000,2018-11-26,"Autus","Greater London Authority","Communities and Intelligence","Team London small grants",14638.9723535557,"large"
"896","Grant to Doorstep Library Network","GBP",9750,2018-12-05,"Doorstep Library Network","Greater London Authority","Communities and Intelligence","Team London small grants",13565.2435118036,"large"
"897","Grant to Faiths Forum for London","GBP",12000,2018-11-27,"Faiths Forum for London","Greater London Authority","Communities and Intelligence","Team London small grants",16332.8991587828,"small"
"898","Grant to Hoxton Health","GBP",9276,2018-12-12,"Hoxton Health","Greater London Authority","Communities and Intelligence","Team London small grants",13664.0811050261,"med"
"899","Grant to Lewisham Refugee Welcome Team","GBP",5000,2018-12-05,"Lewisham Refugee Welcome Team","Greater London Authority","Communities and Intelligence","Team London small grants",4478.56261068084,"med"
"900","Grant to Seeds for Growth","GBP",12000,2018-12-05,"Seeds for Growth","Greater London Authority","Communities and Intelligence","Team London small grants",16727.2756711381,"small"
"901","Grant to St Francis at the Engine Room","GBP",9000,2018-12-12,"St Francis at the Engine Room","Greater London Authority","Communities and Intelligence","Team London small grants",6879.70352987321,"large"
"902","Grant to The Bike Project","GBP",12000,2018-11-26,"The Bike Project","Greater London Authority","Communities and Intelligence","Team London small grants",14274.3913866615,"small"
"903","Grant to The Hebe Foundation","GBP",12000,2018-12-05,"The Hebe Foundation","Greater London Authority","Communities and Intelligence","Team London small grants",14472.1620757648,"med"
"904","Grant to The New Cross Gate Trust","GBP",5055,2018-11-23,"The New Cross Gate Trust","Greater London Authority","Communities and Intelligence","Team London small grants",4705.95781844907,"med"
"905","Refugee and Migrant Data Programme","GBP",25000,2019-01-01,"Kingston Voluntary Action","Greater London Authority","Communities and Intelligence","Civil Society Data Project",35948.4293111701,"med"
"906","Citizen Led Engagement Programme","GBP",12000,2019-03-26,"You Press","Greater London Authority",NA,"Citizen Led Engagement Programme",12330.9492134601,"med"
"907","Citizen Led Engagement Programme","GBP",11999,2019-03-26,"Diversity Living Services","Greater London Authority",NA,"Citizen Led Engagement Programme",14653.6761273201,"med"
"908","Citizen Led Engagement Programme","GBP",11620,2019-03-26,"Salmon Youth Centre","Greater London Authority",NA,"Citizen Led Engagement Programme",9064.22162248758,"small"
"909","Citizen Led Engagement Programme","GBP",11999,2019-03-26,"Hopscotch Women's Resource Centre","Greater London Authority",NA,"Citizen Led Engagement Programme",14893.0751141025,"med"
"910","Citizen Led Engagement Programme","GBP",12000,2019-03-26,"Sistah space","Greater London Authority",NA,"Citizen Led Engagement Programme",13129.7221882242,"large"
"911","Citizen Led Engagement Programme","GBP",12004,2019-03-26,"The Traveller Movement","Greater London Authority",NA,"Citizen Led Engagement Programme",9908.41630121795,"med"
"912","Citizen Led Engagement Programme","GBP",12000,2019-03-26,"Black Out UK","Greater London Authority",NA,"Citizen Led Engagement Programme",15415.8270186108,"small"
"913","Citizen Led Engagement Programme","GBP",11758,2019-03-26,"Royal Association for Deaf People","Greater London Authority",NA,"Citizen Led Engagement Programme",13458.4239016934,"med"
"914","Citizen Led Engagement Programme","GBP",12000,2019-03-26,"Advance Advocacy","Greater London Authority",NA,"Citizen Led Engagement Programme",10533.7045004005,"med"
"915","Citizen Led Engagement Programme","GBP",11956,2019-03-26,"REAP","Greater London Authority",NA,"Citizen Led Engagement Programme",14195.2728485092,"large"
"916","Citizen Led Engagement Programme","GBP",11830,2019-03-26,"Young Europeans","Greater London Authority",NA,"Citizen Led Engagement Programme",14299.5505294789,"small"
"917","Grant to Poplar Harca","GBP",49580,2018-07-11,"Poplar Harca","Greater London Authority","Communities and Social Policy","ESOL Plus Childcare",48684.3201826807,"med"
"918","Grant to Sutton College","GBP",23930,2018-07-11,"Sutton College","Greater London Authority","Communities and Social Policy","ESOL Plus Childcare",27888.1476726539,"med"
"919","Grant to Battersea Academy for Skills Excellence","GBP",20000,2018-10-18,"Battersea Academy for Skills Excellence","Greater London Authority","Communities and Social Policy","ESOL Plus Employer Partnership",25069.2623398135,"large"
"920","Young Londoners Fund","GBP",125777,2019-01-02,"Abianda","Greater London Authority","Education and Youth","Young Londoners Fund",158107.940668089,"med"
"921","Young Londoners Fund","GBP",89237,2018-10-01,"All Change Arts Limited","Greater London Authority","Education and Youth","Young Londoners Fund",108174.283963302,"large"
"922","Young Londoners Fund","GBP",141000,2019-01-07,"Ambition, Aspire, Achieve","Greater London Authority","Education and Youth","Young Londoners Fund",165635.812763112,"small"
"923","Young Londoners Fund","GBP",44489,2019-01-01,"Applecartlive Ltd","Greater London Authority","Education and Youth","Young Londoners Fund",38844.5759236466,"med"
"924","Young Londoners Fund","GBP",90000,2018-10-01,"ARCA Generation","Greater London Authority","Education and Youth","Young Londoners Fund",111524.318716513,"med"
"925","Young Londoners Fund","GBP",140112,2019-01-01,"Art Against Knives","Greater London Authority","Education and Youth","Young Londoners Fund",177706.433323331,"large"
"926","Young Londoners Fund","GBP",146464,2019-01-01,"BANG Edutainment","Greater London Authority","Education and Youth","Young Londoners Fund",159475.250922931,"med"
"927","Young Londoners Fund","GBP",150000,2018-10-01,"Black Training and Enterprise Group","Greater London Authority","Education and Youth","Young Londoners Fund",167080.533989266,"small"
"928","Young Londoners Fund","GBP",149778,2019-01-01,"Body & Soul","Greater London Authority","Education and Youth","Young Londoners Fund",194570.9162235,"large"
"929","Young Londoners Fund","GBP",133749,2019-01-07,"Bollo Brook Youth Centre (prt of London Borough of Ealing)","Greater London Authority","Education and Youth","Young Londoners Fund",175588.991254516,"large"
"930","Young Londoners Fund","GBP",88258,2018-10-01,"Bromley & Croydon Women's Aid","Greater London Authority","Education and Youth","Young Londoners Fund",101598.820612621,"med"
"931","Young Londoners Fund","GBP",140391,2018-10-01,"Cambridge House and Talbot","Greater London Authority","Education and Youth","Young Londoners Fund",145771.041366313,"large"
"932","Young Londoners Fund","GBP",50000,2018-10-01,"Catalyst In Communities","Greater London Authority","Education and Youth","Young Londoners Fund",65952.3065203161,"small"
"933","Young Londoners Fund","GBP",150000,2019-01-01,"Central Greenwich Children's Centres","Greater London Authority","Education and Youth","Young Londoners Fund",121844.948724611,"med"
"934","Young Londoners Fund","GBP",148657,2019-01-01,"Centrepoint","Greater London Authority","Education and Youth","Young Londoners Fund",214051.100457059,"large"
"935","Young Londoners Fund","GBP",150000,2018-11-01,"Charlton Athletic Community Trust","Greater London Authority","Education and Youth","Young Londoners Fund",205776.5006393,"med"
"936","Young Londoners Fund","GBP",148960,2019-01-02,"Circle Community","Greater London Authority","Education and Youth","Young Londoners Fund",214021.626047988,"large"
"937","Young Londoners Fund","GBP",150000,2018-12-01,"College of Haringey, Enfield & North East London","Greater London Authority","Education and Youth","Young Londoners Fund",212526.699189504,"large"
